{
  "$schema": "http://json-schema.org/draft-07/schema#",
  "$id": "https://project-geld.local/schemas/candidate_bundle_v1.schema.json",
  "title": "Project Geld candidate bundle (v1)",
  "description": "Offline, versioned contract for importing an APPROVED factor/strategy candidate from the Emberforge research project into Project Geld. Bundles are declarative data only. They MUST NOT carry executable Python. Importing a valid bundle places it in research-only quarantine and can never enable paper trading or affect deployed strategies.",
  "type": "object",
  "additionalProperties": false,
  "required": [
    "bundle_schema_version", "candidate_id", "name", "source_project_version",
    "signal_spec", "economic_hypothesis", "required_inputs", "frequency",
    "lookback", "approval_status", "created_at"
  ],
  "properties": {
    "bundle_schema_version": { "const": "candidate_bundle_v1" },
    "candidate_id": { "type": "string", "pattern": "^[A-Za-z0-9_.:-]{1,128}$" },
    "name": { "type": "string", "minLength": 1, "maxLength": 200 },
    "source_project_version": { "type": "string", "minLength": 1 },
    "signal_spec": {
      "type": "object",
      "additionalProperties": false,
      "required": ["kind"],
      "description": "Declarative specification only. No executable code.",
      "properties": {
        "kind": { "enum": ["expression", "reference"] },
        "expression": { "type": "string", "description": "Declarative formula in a restricted, non-Python DSL; interpreted by a future engine, never exec()'d." },
        "reference": { "type": "string" },
        "parameters": { "type": "object" }
      }
    },
    "economic_hypothesis": { "type": "string", "minLength": 1 },
    "required_inputs": { "type": "array", "minItems": 1, "items": { "enum": ["open", "high", "low", "close", "volume", "vwap"] } },
    "frequency": { "enum": ["1Min", "5Min", "15Min", "1Day"] },
    "lookback": { "type": "integer", "minimum": 1, "maximum": 5000 },
    "universe_assumptions": {
      "type": ["object", "array", "string"],
      "description": "A structured object, a list of the symbols the factor was evaluated on, or a bare label string such as \"research-only\" (as emitted by Emberforge). Geld binds a label to a concrete point-in-time universe at eval time.",
      "items": { "type": "string" }
    },
    "preprocessing": {
      "type": ["array", "object"],
      "description": "Either an ordered array of step objects, or a settings map (as emitted by Emberforge). No executable code.",
      "items": { "type": "object" }
    },
    "portfolio_construction": { "type": "object" },
    "evaluation_summary": { "type": "object" },
    "data_fingerprint": { "type": "string" },
    "code_hash": { "type": "string", "description": "Fingerprint of the signal specification. NOT code to execute." },
    "approval_status": { "enum": ["draft", "approved", "rejected"] },
    "created_at": { "type": "string", "description": "ISO-8601 creation timestamp." }
  }
}
